{
  "schemaVersion": "nexusengine.domain-manifest.v1",
  "id": "network",
  "label": "Network Providers",
  "kind": "service-domain",
  "status": "candidate",
  "domainPath": "n:network:extensions",
  "entry": "./domains/network/index.js",
  "kits": ["multiplayer-host-kit", "peerjs-transport-provider-kit"]
}
