{
  "schemaVersion": "nexusengine.domain-manifest.v1",
  "id": "simulation",
  "label": "Simulation",
  "kind": "simulation-domain",
  "status": "candidate",
  "domainPath": "n:simulation",
  "entry": "./domains/simulation/index.js",
  "kits": [
    "seeded-world-patch-controller-kit",
    "generic-affordance-descriptor-kit"
  ]
}
